Json Question,Generator Question,Answer,Bleu Score
II. Mehmed'nin Avrupa'da tanınan adı nedir?,Fatih Sultan Mehmed'in Avrupa'da tanınan adı nedir?,Grand Turco 'Büyük Türk' veya Turcarum Imperator 'Türk İmparatoru',0.41113361690051975
II. Mehmed kaç yıl boyunca hüküm sürdü?,II. Mehmed ilk olarak kaç yıl boyunca hüküm sürdü?,30 yıl boyunca,0.5133450480401704
II. Mehmed İstanbul'u kaç yaşında fethetti?,II. Mehmed kaç yaşında İstanbul'u fethetti?,21 yaşında,0.25406637407730737
İstanbul'un fethi ile hangi çağın sonununu getirdiği kabul edildi?,"II. Mehmed, 21 yaşında İstanbul'u fethetek 1000 yıllık Bizans İmparatorluğu'na son verdi ve bu olay birçok tarihçi tarafından hangi olay Yeni Çağ'ın başlangıcı olarak kabul edildi?",Orta Çağ'ın sonu,0.03197383344450448
İstanbul'un fethi ile hangi çağın başlangıçı olarak kabul edildi?,II. Mehmed Orta Çağ'ın sonu ne olarak kabul edildi?,Yeni Çağ'ın başlangıcı,0.17747405280050263
Yavuz Sultan Selim'in saltanatı kısa sürmüş olsa da nasıl bir dönem geçirmiştir?,Sultan Selim hangi hazineyi ağzına kadar doldurmuştur?,babasından devraldığı boş hazineyi ağzına kadar doldurmuştur,0.03214954573057458
İsyancılar isteklerini bildirmek üzere nereye bir heyet gönderdiler?,isyancılar isteklerini bildirmek üzere nereye bir heyet gönderdiler?,Edirne'ye,0.8408964152537145
I. Süleyman'ın doğum tarihi kaçtır?,I. Süleyman ne zaman ölmüştür?,6 Kasım 1494,0.10682175159905853
I. Süleyman'ın ölüm tarihi kaçtır?,I. Süleyman hangi tarihte Zigetvar'da ölmüştür?,7 Eylül 1566,0.08116697886877472
I. Süleyman Osmanlı İmparatorluğunun kaçıncı İslam halifesidir?,I. Süleyman kaçıncı İslam halifesi olmuştur?,89.,0.19433094436376075
I. Süleyman Doğu'da nasıl bilinmektedir?,I. Süleyman Doğu'da hangi padişah olarak bilinmektedir?,Kanunî Sultan Süleyman,0.2626909894424158
I. Süleyman saltanatının toplam ne kadar süresini seferlerde geçirmiştir?,I. Süleyman saltanatının toplam kaç ayını geçirmiştir?,10 yıl 1 ayını,0.32668286409255015
Süleyman'ın Osmanlı Sultanları arasındaki farkı nedir?,I. Süleyman böylece neyi olmuştur?,imparatorluğun hem en uzun süre görev yapan hem en çok sefere çıkan ve de en uzun süre sefer yapan Osmanlı Sultanı,0.0
I. Süleyman hangi olaydan sonra tahta çıktı?,I. Süleyman 1520 yılında ne zaman tahta çıktı?,babası I. Selim'in ölümünün ardından,0.1561969968460128
I. Süleyman Batıda nereleri Osmanlı toprağına kattı?,I. Süleyman Batıda hangi kısmını imparatorluk topraklarına kattı?,"Belgrad, Rodos, Boğdan ve Macaristan'ın büyük kısmını",0.22089591134157885
I. Süleyman Viyana'yı hangi tarihre kuşattı?,I. Süleyman Viyana'yı ne zaman kuşattı?,1529 yılında,0.32466791547509893
Safevîlerle yapılan savaşlar sonrasında ne oldu?,Safevîlerle yapılan savaşlar sonrasında nereyi ele geçirdi?,Irak'ı ele geçirdi,0.41113361690051975
Osmanlı İmparatorluğunun Mağrip'te sınırları nereye kadar uzandı?,Mağrip'te imparatorluğun sınırları nereye kadar uzandı?,Fas'a kadar,0.4548019047027907
Osmanlı Donanması nereye kadar genişledi?,Osmanlı Donanması nereye kadar hakimiyet kurmuştu?,Akdeniz'den Kızıldeniz'e kadar,0.5081327481546147
I. Süleyman padişahlığı döneminde Osmanlı topraklarını kaç km2'ye çıkardı?,I. Süleyman padişahlığı döneminde padişahlığı döneminde nereye ulaştırdı?,14.893.000 km2'ye,0.3050975216056289
Çaldıran Muharebesi hangi tarihte oldu?,Çaldıran Muharebesi hangi tarihte yapılmıştır?,23 Ağustos 1514'te,0.668740304976422
Çaldıran Muharebesi nasıl sonuçlandı?,Çaldıran Muharebesi kimin zaferiyle sonuçlandı?,Osmanlı Ordusu'nun kesin zaferiyle sonuçlandı,0.23643540225079396
Şeyh Haydar'ın ölüm tarihi nedir?,"Osmanlı padişahı II. Bayezid, Şah İsmail'in babası Şeyh Haydar'ın ölüm tarihi nedir?",'1488',0.31702331385234306
"II. Bayezid, Şeyh Haydar'ın takipçileri olan Kızılbaşlar'a ne demiştir?",Şeyh Haydar'ın takipçileri olan Kızılbaşlar'a ne demiştir?,"'Haydar'ın yolunu şaşırmış sürüsü, Allah onlara lânet etsin!'",0.7514772930752859
Safevî şeyhlerinin nerede çok sayıda müritleri vardı?,"Safevî şeyhlerinin nerede çok sayıda müritleri olduğu, bu müritlerin sıkça şeyhlerini ziyaret ettikleri, beraberinde hediyeler götürdükleri ve şeyhlerinden eğitim almak için İran'a gittikleri bilinmekteydi?",Anadolu'da,0.19383418023456653
Safevî şeyhlerinin müritleri neden İran'a gidiyordu?,"Safevî şeyhlerinin Anadolu'da çok sayıda müritleri olduğu, bu müritlerin sıkça şeyhlerini ziyaret ettikleri, beraberinde hediyeler götürdükleri ve ne için İran'a gittikleri bilinmekteydi?",şeyhlerinden eğitim almak için,0.041080536624612696
Safevi Devleti ne zaman kuruldu?,"II. Bayezid, hangi yılda Safevi Devleti'nin kurulmasıyla Kızılbaşlar'ın İran'a gitmesini engellemeye çalışmıştır?",1501 yılında,0.033864985683445356
Osmanlı Devleti neden Kızılbaşlar'ın İran'a gitmesini engellemeye çalıştı?,Osmanlı Devleti Şah İsmail'in Kızılbaş inanışına sahip olmasını ne yaptı?,Anadolu'da büyük bir taraftar kitlesine sahip olmasını ve üstelik komşu topraklarda yükselmesini büyük bir tehdit olarak görmüştür,0.08392229812593097
Osmanlılar ile Venedik arasındaki savaş sırasında Osmanlılar nereleri ele geçirdi?,Osmanlılar ile Venedik arasındaki savaşlar boyunca Osmanlılar nereleri ellerine geçirdiler?,Eğriboz başta olmak üzere birçok adaları,0.31239399369202553
Osmanlılar ile Venedik arasındaki Aantlaşmanın bir diğer şartı nedir?,Antlaşmanın bir diğer şartına göre neresi İstanbul'a gönderecekti?,Venedik Cumhuriyeti en tecrübeli ressamlarından birini Fatih Sultan Mehmet'in tablosunu yapmak üzere İstanbul'a gönderecekti,0.09746997877627238
Uzun Hasan kimdir?,Otlukbeli Muharebesi kimdir?,Akkoyunlu sultanı,0.2259005009024612
Osmanlılar Karakoyunlularla müttefikken Akkoyunlular kimi desteklemiştir?,Osmanlılar Karakoyunlularla müttefikken Akkoyunlular nereyi desteklemişlerdi?,Timur'u,0.5081327481546147
Uzun Hasan ne zaman Trabzon İmparatoru'nun kızıyla evlenmiştir?,Uzun Hasan ne zaman Trabzon İmparatoru IV. İoannis'in kızı Despina Hatun ile evlenmiştir?,1458’de,0.3026643726685863
Uzun Hasan yeğeni Osmanlı Sultanı II. Mehmed’ten ne istedi?,Osmanlı Sultanı II. Mehmed’ten ne istedi?,"Trabzon İmparatorluğu vergisinin affedilmesinden başka, Despina Hatun'a çeyiz olarak verilmiş olan Kayseri bölgesini ve önceki hediyeleri",0.6065306597126334
"Fatih, Uzun Hasan ve müttefiki Trabzon İmparatorluğu kimlere karşı harekete geçti?","Fatih, Uzun Hasan ve müttefiki Trabzon İmparatorluğu ile kime karşı harekete geçti?",Gürcülere karşı,0.6340466277046861
Fatih Gürcülere karşı hangi tarihte harekete geçti?,"Fatih, Uzun Hasan ve müttefiki Trabzon İmparatorluğu ile Gürcülere karşı ne zaman harekete geçti?",1461’de,0.08032276872815308
Fatih 1459’da nereyi aldı?,"Uzun Hasan’ın, 1459’da zaptettiği nereyi aldı?",Koyulhisar’ı,0.1796520559815421
"Ferhat Paşa Antlaşması sonucunda Tebriz, Karabağ, Gürcistan, Dağıstan ve Şirvan kimlere bırakıldı?","Ferhat Paşa Antlaşması sonucunda Tebriz, Karabağ, Gürcistan, Dağıstan ve Şirvan kime bırakıldı?",Osmanlılara,0.8265168183793802
Karamanoğlu kuvvetleri doğuya kaçarken Akkoyunlulara nereye geçti?,Karamanoğlu kuvvetleri doğuya kaçarken ne oldu?,Akkoyunlular sınırı geçti,0.43012508513132625
İki devleti birbirinden ayıran Türkmen devletler hangileridir?,İki devleti birbirinden ayıran 4 tane Türkmen tampon devleti vardı?,"'Karamanoğulları, Ramazanoğulları, Akkoyunlular ve Dulkadiroğulları'",0.2777619034011791
Fatih neden Memlüklüler yerine Akkoyunlular ve Karamanoğulları üzerine yürümüştür?,Fatih Sultan Mehmed Memlüklüler yerine Akkoyunlular ve Karamanoğulları üzerine yürürken neden Akkoyunluları yıkmıştır?,Uzun Hasan'dan ve Karamanoğulları'ndan destek bulamayınca,0.4089601472043678
Fatih neden Memlüklüler yerine Akkoyunlular ve Karamanoğulları üzerine yürümesinin sonucu nedir?,Memlüklüler yerine Akkoyunlular ve Karamanoğulları üzerine yürürken ne oldu?,Akkoyunluları yıkmıştır,0.4703490742954983
Şahkulu İsyanı ne zaman çıkmıştır?,Şahkulu İsyanı hangi tarihte gerçekleşmiştir?,1511 yılı Nisan ayında,0.21364350319811704
1511 yılı Nisan ayında çıkan isyanın adı nedir?,Kim 1511 yılı Nisan ayında Şah İsmail'i kurtarıcı olarak kabul etti?,Şahkulu İsyanı,0.23462350320528
Şahkulu İsyanı kim tarafından çıkarılmıştır?,"Şah İsmail'in şah olma yolunda başkaldırdığını duydukları için kim makam ve mevkiden ziyade şeyhleri Şah İsmail'in başarmasını sağlamak, hiç değilse bu yolda ölmek için isyan ediyor?",Kızılbaşlar,0.014445809981770858
Kızılbaşlar'ın öxelliği neydi?,Kızılbaşlar ne yapıyordu?,ekonomik ve sosyal sebeplerden ziyade mürşidi kamil olarak kabul edip büyük bağlılık gösterdikleri şeyhleri Şah İsmail'le savaşmak için can atıyor dinî coşku ve fanatizmle hareket ediyorlardı,0.0
Kızılbaşlar neden isyan ediyordu?,"Kızılbaşlar neden Kızılbaşlar makam ve mevkiden ziyade şeyhleri Şah İsmail'in başarmasını sağlamak, hiç değilse bu yolda ölmek için isyan ediyordu?",Şah İsmail'in şah olma yolunda başkaldırdığını duydukları için,0.05415315253510895
Kızılbaşlar neden İran'a gidiyordu?,Kızılbaşlar makam ve mevkiden ziyade şeyhleri ne için isyan ediyor?,"Şah İsmail'in başarmasını sağlamak, hiç değilse bu yolda ölmek için",0.041961149062965476
Osmanlı'da yeni sorunların baş gösterme sebebleri nelerdir?,Kim yeni sorunlara zemin hazırladı?,vergi düzeninde yapılan adaletsizlikler ve devlet yönetiminde Türkmenlerin dışlanmaya başlaması,0.07160476144948855
Nerede hanedan değişikliği olmuştu?,Ayrıca nerede hanedan değişikliği olmuştu?,İran'da,0.3976353643835253
İran'da ki yeni hanedan kimdi?,Yeni hanedan kimdi?,Safevîler Şii,0.23196236872272216
Safevîler Şii hedefi neydi?,Safevîler Şii ne istiyorlardı?,etki alanlarını arttırmak istiyorlardı,0.31947155212313627
Safevîler Şii neden Anadolu'ya dailer gönderdi?,Safevîler Şii ne için Anadolu'ya dailer gönderdi?,Şii propogandası yapmak için,0.3073940764756322
II. Selim'in ölüm tarihi nedir?,II. Selim hangi tarihte vefat etmiştir?,15 Aralık 1574,0.08116697886877472
II. Selim Osmanlın'nın kaçıncı padişahıdır?,II. Selim kaçıncı Osmanlı padişahıdır?,11.,0.25406637407730737
II. Selim padişah olur olmaz ilk seferini nereye yaptı?,II. Selim ilk seferini hangi ülkeye yaptı?,Batı’ya,0.14759564526951546
II. Selim döneminde kayıtsız şartsız teslim olanlar nerelerdi?,II. Selim hangi ülkeler kayıtsız şartsız teslim olanlar arasındaydı?,"Kıbrıs, Tunus",0.3549481056010053
II. Selim döneminde yetişen kaptanlardan biri kimdir?,II. Selim kimin zamanında yetişti?,Turgut Reis,0.14320952289897707
II. Selim nereye gömülmüştür?,II. Selim 15 Aralık 1574 günü vefat etmiştir?,Ayasofya'daki türbesine,0.11044795567078944
II. Selim padişahlığı nereye kadar sürmüştür?,II. Selim padişahlığını nereye kadar sürdürmüştür?,Ölümüne kadar,0.2295748846661433
III. Murad'ın ölüm yeri neresidir?,Hangi şehir daha önce defalarca kuşatılmıştı?,İstanbul,0.0
Mostaganem Savaşı hangi tarihte oldu?,"Hangi yılda Osmanlı Devleti ile İspanyol İmparatorluğu - Fas Sultanlığı arasında yapılan, Osmanlı zaferiyle sonuçlanan savaş oldu?",1558 yılında,0.02286956778061901
III. Murad babası padişah olduktan sonra nereye gönderildi?,III. Murad babası padişah olduktan sonra hangi sancakbeyliğe gönderildi?,Manisa Sancakbeyliğine,0.6104735835807844
III. Murad ne zaman tahta geçti?,III. Murad hangi tarihte İstanbul'a gelerek Osmanlı tahtına oturdu?,22 Aralık 1574'te,0.09535414040914189
19. Yüzyıl başlarında hangi devletler Sırbistan’da halkı Osmanlı egemenliğine karşı kışkırtmıştır ?,19. yüzyıl başlarında kimler Sırbistan'da halkı Osmanlı egemenliğine karşı kışkırtma siyaseti uygulamaya başlamışlardı?,Avusturya ve Rusya,0.21401603033752975
Sırplar kimin önderliğinde ayaklandılar ?,Kim 21 Eylül 1813'te diğer isyancılarla birlikte canını kurtarmak için Avusturya'ya kaçtı?,Kara Yorgi,0.0
Kara Yorgi ve isyancılar canlarını kurtarmak için Avusturya'ya ne zaman kaçtılar ?,Kara Yorgi ne zaman diğer isyancılarla birlikte canını kurtarmak için Avusturya'ya kaçtı?,21 Eylül 1813'te,0.18527972555830952
III. Selim boğazları hangi tarihte kapattı ?,III. Selim ne zaman boğazları kapattı ve Rusya'ya savaş ilan etti?,22 Aralık 1805 tarihinde,0.08913765521398126
Rus donanması Osmanlı donanmasını hangi tarihte Çanakkale boğazı civarında yendi ?,Rus donanması Osmanlı donanmasını hangi tarihte Çanakkale boğazı civarında 19-29 Haziran 1807 tarihleri arasında da Limni adası yakınında civarında yendi?,11 Mayıs 1807 tarihinde,0.401577332834242
Tilsit Antlaşması ne zaman imzalanmıştır ?,Tilsit Antlaşması hangi tarihte imzalanmıştır?,9 Temmuz 1807 yılında,0.1749165062636126
Tilsit Antlaşması hangi devletler arasında imzalanmıştır ?,"Tilsit Antlaşması, 9 Temmuz 1807 yılında hangi iki devlet arasında imzalanan antlaşmadır?",Fransa ile Rusya,0.044568827606990644
Osmanlının paylaşılması durumunda hangi şehirlere dokunulmayacaktı ?,Sadece kime dokunulmayacaktı?,İstanbul ve Rumeli'ye,0.0
Kavalalı Mehmet Ali Paşa nerede başı bozuk askerin belli bir disiplin altına alınmasını sağlamıştır ?,"Askeri yeteneklere de sahip olan Kavalalı Mehmet Ali Paşa nerede başı bozuk askerin belli bir disiplin altına alınmasını sağlamış, başarı gösterdiği için Mısır'a vali olmuştu?",Kahire'de,0.48758897719987776
Kavalalı Mehmet Ali Paşa kimin desteğiyle kuvvetli bir ordu ve donanma kurmuştur ?,kimin desteğiyle kuvvetli bir ordu ve donanma kurmuş?,Fransızların desteğiyle,0.4500994164652013
"Kavalalı Mehmet Ali Paşa, Mora isyanı sırasında Mora ve Girit valiliklerinin kendisine verilmesi şartıyla kime yardım etmişti ?","Kavalalı Mehmet Ali Paşa, Mora isyanı sırasında Mora ve Girit valiliklerinin kendisine verilmesi şartıyla kime yardım etmişti?",Sultan İkinci Mahmut'a,0.8817122476287481
Kim Mora isyanı sırasında Mora ve Girit valiliklerinin kendisine verilmesi şartıyla Sultan İkinci Mahmut'a yardım etmişti ?,"Mora valiliği yerine Suriye valiliğini isteyen kim, bu isteğinin reddedilmesi üzerine Suriye'yi işgal etti?",Kavalalı Mehmet Ali Paşa,0.022920842316175777
Kim isyan sırasında Suriye'yi aldı ? ,Kim isyan sırasında Suriye'yi aldı?,Kavalalı Mehmet Ali Paşa'nın oğlu olan İbrahim Paşa,0.5475182535069453
"Kavalalı Mehmet Ali Paşa'nın oğlu olan İbrahim Paşa, ne zaman Suriye'yi aldı ?","Kavalalı Mehmet Ali Paşa'nın oğlu olan İbrahim Paşa, hangi sırada Suriye'yi aldı?",isyan sırasında,0.5810588684968079
Torosları geçen İbrahim Paşa nerede Osmanlı kuvvetlerini yenilgiye uğrattı ?,Torosları geçen İbrahim Paşa nerede Osmanlı kuvvetlerini yenilgiye uğrattı?,Adana ve Konya'da,0.7725505949016372
Kütahya Antlaşması kimler arasında imzalandı ?,"Kütahya Antlaşması, hangi devletler arasında 14 Mayıs 1833 tarihinde imzalanan, Birinci Mısır-Osmanlı Savaşını sona erdirip Şam, Girit ve Adana vilayetlerinin yeni statüsünü belirleyen bir barış ve düzenleme antlaşmasıdır?",Osmanlı İmparatorluğu ile Mısır Valisi Kavalalı Mehmet Ali Paşa arasında,0.015880117714047366
"İzvança Savaşı galibiyetine karşın, hangi imparatorluk, önemli ölçüde tahribata uğrattığı Lehistan'ın, Avusturya ile ittifaka girmesine neden oldu?","İzvança Savaşı galibiyetine karşın, hangi imparator, önemli ölçüde tahribata uğrattığı Lehistan'ın, Avusturya ile ittifaka girmesine neden oldu?",Osmanlı İmparatorluğu,0.8282477531331041
Kim bu yardımına karşılık Mora’yı istedi ?,"Osmanlılar Suriye’yi kim kime vermek istemeyince Mehmet Ali Paşa saldırıya geçti ve önce Konya, sonra da Kütahya’ya kadar ilerledi?",Mehmet Ali Paşa,0.0
Yunanistan bağımsız olunca Mora da nereye katıldı ?,Yunanistan bağımsız olunca Mora da nereye katıldı ve Mehmet Ali Paşa bu sefer Suriye valiliğini istedi?,Yunanistan'a,0.37239098949398236
Osmanlıların Rusları 1711 yılında Prut'ta yenmesi İsveç'i rahatlattıysa da kimler savaştan çabuk çekildi?,Kim Rusları 1711 yılında Prut'ta yenmesi İsveç'i rahatlattıysa da Osmanlılar savaştan çabuk çekildi?,Osmanlılar,0.6703420896351792
Ne imzalandı ?,"Meselenin iyice püsküllü bir hal alması Sultan II. Mahmud'u şaşırttığından, o sırada Rusya Devleti tarafından sunulan yardım teklifi kabul edildi ve hangi antlaşma imzalandı?",Hünkar İskelesi Antlaşması,0.0
Kimin tarafından sunulan yardım teklifi kabul edildi ?,"Meselenin iyice püsküllü bir hal alması Sultan II. Mahmud'u şaşırttığından, o sırada kim tarafından sunulan yardım teklifi kabul edildi?",Rusya Devleti tarafından,0.18951629567590741
Mısır'da müstakil bir devlet kurmayı düşleyen Mehmed Ali Paşa isyan bayrağını resmen ne zaman açmış ?,Mehmed Ali Paşa ne zaman isyan bayrağını resmen açmış?,1832 yılında,0.155806278394634
"Mısır ordusu, Konya’da Sadrazam Mehmed Reşid Paşa kumandasındaki Osmanlı ordusunu ne zaman yendi ?",Mısır ordusu ne zaman Konya’da Sadrazam Mehmed Reşid Paşa kumandasındaki Osmanlı ordusunu yendi?,21 Aralık 1832’de,0.5799150677091909
"Tek başına harekete geçerek, Osmanlı Devleti'ne bir ittifak teklifinde bulunan kimdir ?","Kim tek başına harekete geçerek, Osmanlı Devleti'ne bir ittifak teklifinde bulundu?",Rusya,0.6196760459608335
"Nerede denetimi ele geçiren isyancılar, sadrazamlığa Kavanoz Ahmed Paşa'yı, şeyhülislamlığa da İmam Mehmed Efendi'yi getirdiler?","nerede denetimi ele geçiren isyancılar, sadrazamlığa Kavanoz Ahmed Paşa'yı, şeyhülislamlığa da İmam Mehmed Efendi'yi getirdiler?",İstanbul'da,0.9253911813809743
Kim 27. Osmanlı padişahı ve 106. İslam halifesidir?,Kim 27. Osmanlı padişahı ve 106. İslam halifesidir?,I. Abdülhamid,1.0
"IV. Murad, saltanatının ilk zamanlarında küçük yaşından ötürü kimin etkisi altında kaldı?","1623 yılında sultan olan IV.Murad, saltanatının ilk zamanlarında küçük yaşından ötürü kimin etkisi altında kaldı?",annesinin,0.6262844962765469
Bazı kaynaklarda IV. Mustafa'nın annesinin kim olduğu iddia edilir?,Bazı kaynaklarda IV. Mustafa'nın annesinin neyi olduğu iddia edilir?,Nükhetsezâ Hanım,0.5969491792019646
"Osmanlı-Venedik Antlaşması, hangi devlet ile Venedik Cumhuriyeti arasında imzalanmıştır?",Osmanlı-Venedik Antlaşması hangi devlet ile Venedik Cumhuriyeti arasında imzalanmıştır?,Osmanlı Devleti,0.7506238537503395
"Hangi devlet ve Rus Çarlığı, Dinyeper Irmağı ile güney Buğ Irmağı arasında yerleşme yapılmamasını garanti etti?",Kim taht kavgalarıyla meşguldü?,Osmanlı,0.0
Kimlerin Dinyeper Irmağı ve yan ırmakları üzerinde balıkçılık yapma hakları değişmeden kalacaktı?,Hangi Kazakların Dinyeper Irmağı ve yan ırmakları üzerinde balıkçılık yapma hakları değişmeden kalacaktı?,Zaporozhtsi Kazaklarının,0.8242367502646054
"IV. Mehmed ve Turhan Sultan'dan tam yetki alan kim, İstanbul ve Anadolu'da güvenliği sağladı?",1656 yılında iç ve dış sorunlara çözüm bulmak üzere Turhan Sultan tarafından sadrazamlığa kim getirildi?,Köprülü Mehmet Paşa,0.031251907639724415
Ne zaman sadrazamlığa Fazıl Ahmet Paşa geldi?,kimin ölümünden sonra sadrazamlığa Fazıl Ahmet Paşa geldi?,Köprülü Mehmet Paşa'nın ölümünden sonra,0.5169731539571706
"Kim, Avusturya'dan Uyvar Kalesini alıp Vasvar Antlaşması'nı imzaladı?",Kim Avusturya'dan Uyvar Kalesini alıp Vasvar Antlaşması'nı imzaladı?,Fazıl Ahmet Paşa,0.8408964152537145
"II. Osman, planlarını uygulayacak ne bulamadı?",II. Osman kendisine planlarını uygulayacak bir neyi bulamadı?,sadrazam,0.13134549472120793
II. Osman muhalefetlere rağmen neye karar verdi?,"II. Osman, kendisine yapılan muhalefetlere rağmen hangi sefere karar verdi?",Lehistan seferine,0.12549310621989482
"IV. Mehmed, sadrazam ile birlikte Lehistan seferine çıktı ve ne zaman Bucaş Antlaşması'nı imzaladıktan sonra Edirne'ye döndü?","IV. Mehmed, sadrazam ile birlikte Lehistan seferine çıktı ve hangi yılda Bucaş Antlaşması'nı imzaladıktan sonra Edirne'ye döndü?",1672 yılında,0.762465858623486
"IV. Mehmed, sadrazam ile birlikte Lehistan seferine çıktı ve ne zaman Edirne'ye döndü?","IV. Mehmed, sadrazam ile birlikte Lehistan seferine çıktı ve hangi antlaşmadan sonra Edirne'ye döndü?",1672 yılında Bucaş Antlaşması'nı imzaladıktan sonra,0.6450001140844255
Neden ertesi yıl yeniden sefere çıkıldı ve savaş 1676 yılında son buldu?,1676 yılında ne sebeple ertesi yıl yeniden sefere çıkıldı ve savaş 1676 yılında son buldu?,Lehistan'ın antlaşma şartlarına uymaması yüzünden,0.7012055133086459
"1676 yılında Fazıl Ahmet Paşa ölünce IV. Mehmed, sadrazamlığa kimi getirdi?","1676 yılında Fazıl Ahmet Paşa ölünce IV. Mehmed, sadrazamlığa neyi getirdi?",Köprülü ailesinin yetiştirdiği Merzifonlu Kara Mustafa Paşa'yı,0.8070557274927981
"Hangi ülkenin ileri görüşlü Çarı Deli Petro, İsveç tehdidini bertaraf etmek için harekete geçti?","kimin ileri görüşlü Çarı Deli Petro, İsveç tehdidini bertaraf etmek için harekete geçti?",Rusya'nın,0.8446319809857226
"IV. Mehmed, sadrazamla birlikte ne için sefere çıktı","IV. Mehmed, sadrazamla birlikte ne için sefere çıktı?",Rusya'nın ele geçirdiği Çehrin kalesini geri almak için,0.8408964152537145
Neyin ardından Osmanlı ordusu 1678'de Edirne'ye döndü?,1678'de Osmanlı ordusu neyin ardından Edirne'ye döndü?,Kalenin alınmasının,0.20556680845025987
"Hangi ordu Pul-i Şikeste Savaşı'nda yenilmesine rağmen, İranlılar, Erdebil şehrinin Osmanlılar'ın eline geçme ihtimali üzerine barış istediler?","Kim Pul-i Şikeste Savaşı'nda yenilmesine rağmen, İranlılar, Erdebil şehrinin Osmanlılar'ın eline geçme ihtimali üzerine barış istediler?",Osmanlı ordusu,0.8742223609582066
Kaç yılında Ruslarla 20 yıl süreli bir barış antlaşması yapıldı?,hangi yılda Ruslarla 20 yıl süreli bir barış antlaşması yapıldı?,1681 yılında,0.7598356856515925
1681 yılında kimlerle 20 yıl süreli bir barış antlaşması yapıldı?,24 Eylül 1805 tarihinde Osmanlılar kime yeni bir dostluk antlaşması imzaladılar?,Ruslarla,0.044568827606990644
Kasr-ı Şirin Antlaşması ne çeşit bir antlaşmadır?,Kasr-ı Şirin Antlaşması hangi antlaşmadır?,barış antlaşmasıdır.,0.28641904579795413
"Hangi devletin Bucaş Antlaşması'ndaki vergi maddesini kabul etmemesi üzerine, 1672-1676 Osmanlı-Lehistan Savaşı başladı?","Hangi ülke, Bucaş Antlaşması'ndaki vergi maddesini kabul etmemesi üzerine, 1672-1676 Osmanlı-Lehistan Savaşı başladı?",Lehistan,0.842362674378975
"Bucaş Antlaşması, hangi devletin toprak kazandığı son antlaşmadır?","Bucaş Antlaşması, kimin toprak kazandığı son antlaşmadır?",Osmanlı Devleti'nin,0.42383656282787796
"Bucaş Antlaşması, Osmanlı Devleti'nin ne kazandığı son antlaşmadır?","Bucaş Antlaşması, Osmanlı Devleti'nin neyi kazandığı son antlaşmadır?",toprak,0.5
"Büyük Kuzey Savaşı, Vestfalya Barışı sonrası nereyi yeniden şekillendiren savaşlar dizisidir?","Büyük Kuzey Savaşı, Vestfalya Barışı sonrası hangi ülkeyi yeniden şekillendiren savaşlar dizisidir?",Kuzey Avrupa'yı,0.6340466277046861
"Hangi savaş sırasında sırasında II. Gustaf Adolf önderliğinde İsveç orduları, Avrupa içlerine dek girmiş, Fransa sınırına dek tüm Alman birliklerini süpürmüştü?","hangi savaş sırasında II. Gustaf Adolf önderliğinde İsveç orduları, Avrupa içlerine dek girmiş, Fransa sınırına dek tüm Alman birliklerini süpürmüştü?",Otuz Yıl Savaşı sırasında,0.8719033716275264
Hangi ülke savaştan mağlup ayrılmış oldu?,hangi ülke savaştan mağlup ayrılmış oldu?,İsveç,0.7598356856515925
"Otuz Yıl Savaşı sırasında II. Gustaf Adolf önderliğinde İsveç orduları, nereye dek girmiş, Fransa sınırına dek tüm Alman birliklerini süpürmüştü?","Otuz Yıl Savaşı sırasında II. Gustaf Adolf önderliğinde İsveç orduları, neye dek girmiş, Fransa sınırına dek tüm Alman birliklerini süpürmüştü?",Avrupa içlerine,0.8578928092681435
"Otuz Yıl Savaşı sırasında II. Gustaf Adolf önderliğinde İsveç orduları, Avrupa içlerine dek girmiş, Fransa sınırına dek neleri süpürmüştü?","Otuz Yıl Savaşı sırasında II. Gustaf Adolf önderliğinde İsveç orduları, Avrupa içlerine dek girmiş, Fransa sınırına dek neyi süpürmüştü?",tüm Alman birliklerini,0.8979542144404234
"İsveç'in bu şaşırtıcı gücü, kimi bile ürkütecek boyuttaydı?","İsveç'in bu şaşırtıcı gücü, neyi bile ürkütecek boyuttaydı?",müttefiki Fransa'yı,0.5
"Kim, ordusunun başına geçerek ittifak güçleriyle savaştı?",Kim ordusunun başına geçerek ittifak güçleriyle savaştı?,İsveç'in genç ve dinamik kralı Demirbaş Şarl,0.8091067115702212
